Book Id,Title,Author,Author l-f,Additional Authors,ISBN,ISBN13,My Rating,Average Rating,Publisher,Binding,Number of Pages,Year Published,Original Publication Year,Date Read,Date Added,Bookshelves,Bookshelves with positions,Exclusive Shelf,My Review,Spoiler,Private Notes,Read Count,Owned Copies
15813997,The Gardener's Guide to Common-Sense Pest Control,William Olkowski,"Olkowski, William","Sheila Daar, Helga Olkowski","=""1600855008""","=""9781600855009""",0,4.20,Taunton Press,Paperback,400,2013,2013,,2022/04/02,to-read,to-read (#48),to-read,,,,0,0
15079662,Keeping Bees in Towns and Cities,Luke Dixon,"Dixon, Luke",,"=""1604692871""","=""9781604692877""",0,3.65,Timber Press,Paperback,184,2012,2012,,2022/04/02,to-read,to-read (#47),to-read,,,,0,0
968295,Republic (The ^AWorld's Classics),Plato,"Plato, Plato",Robin Waterfield,"=""0192126040""","=""9780192126047""",0,3.96,Oxford University Press,Hardcover,,1993,-400,,2022/04/02,to-read,to-read (#46),to-read,,,,0,0
77959,Lost in the Cosmos: The Last Self-Help Book,Walker Percy,"Percy, Walker",,"=""0312253990""","=""9780312253998""",0,4.06,Picador,Paperback,272,2000,1983,2022/03/31,2017/08/17,,,read,,,,1,0
57008295,The Wordhord: Daily Life in Old English,Hana Videen,"Videen, Hana",,"=""1788166108""","=""9781788166102""",0,4.24,Profile Books,Hardcover,284,2021,2021,,2022/03/30,"to-read, infinity-pile","to-read (#44), infinity-pile (#20)",to-read,,,,0,0
31247641,Shadowbahn,Steve Erickson,"Erickson, Steve",Malcolm Hillgartner,"=""0735212015""","=""9780735212015""",0,3.45,Blue Rider Press,Hardcover,300,2017,2017,,2022/03/23,"to-read, infinity-pile","to-read (#43), infinity-pile (#19)",to-read,,,,0,0
60213,Peace,Gene Wolfe,"Wolfe, Gene",,"=""0312890338""","=""9780312890339""",5,4.11,Orb Books,Paperback,272,1995,1975,2015/08/26,2015/12/29,re-read,re-read (#2),read,,,,2,0
54366406,Trace and Aura The Recurring Lives of St. Ambrose of Milan,Patrick Boucheron,"Boucheron, Patrick","Willard Wood, Lara Vergnaud","=""1635420067""","=""9781635420067""",0,3.25,Other Press,Hardcover,544,2021,,,2022/03/20,to-read,to-read (#42),to-read,,,,0,0
30933,Brideshead Revisited,Evelyn Waugh,"Waugh, Evelyn",,"=""0316926345""","=""9780316926348""",0,4.00,Back Bay Books,Paperback,351,1999,1945,,2022/03/19,to-read,to-read (#41),to-read,,,,0,0
28789711,SPQR: A History of Ancient Rome,Mary Beard,"Beard, Mary",,"=""1631492225""","=""9781631492228""",0,4.06,Liveright,Paperback,606,2016,2015,,2022/03/15,"to-read, infinity-pile","to-read (#40), infinity-pile (#18)",to-read,,,,0,0
362975,The Lords of the Realm: The Real History of Baseball,John Helyar,"Helyar, John",,"=""0345465245""","=""9780345465245""",0,4.41,Random House Publishing Group,Paperback,640,1995,1994,,2022/03/13,"to-read, infinity-pile","to-read (#39), infinity-pile (#17)",to-read,,,,0,0
1439,Hamlet's Mill: An Essay Investigating the Origins of Human Knowledge and Its Transmission Through Myth,Giorgio de Santillana,"Santillana, Giorgio de",Hertha von Dechend,"=""0879232153""","=""9780879232153""",0,4.22,"David R. Godine, Publisher",Paperback,450,2015,1969,,2022/03/13,"to-read, infinity-pile","to-read (#38), infinity-pile (#16)",to-read,,,,0,0
18526922,Secrets in a Dead Fish: The Spying Game in the First World War,Melanie King,"King, Melanie",,"=""1851242600""","=""9781851242603""",3,3.47,"Bodleian Library, University of Oxford",Hardcover,128,2014,2014,2022/03/01,2022/02/18,,,read,"This is a fun little book, but very disjointed. I would like to have read a more coherent narrative around who the major characters were, how their techniques developed, how they interacted with other branches of the military, how they affected the course of wars, etc. Instead it's presented as a stream of loosely related paragraph-long anecdotes, which make neat little fun facts but don't provide a broader view of the topic.",,,1,0
43261040,The Fall Of Gondolin,J.R.R. Tolkien,"Tolkien, J.R.R.",,"=""0358131456""","=""9780358131458""",0,4.08,William Morrow Paperbacks,Paperback,304,2019,2018,2022/02/15,2022/01/16,,,read,,,,1,0
21153463,"Talking with God: Four Treatises on the Interior Life from St. Alphonsus Liguori; The Way to Converse with God, A Short Treatise on Prayer, Mental Prayer, The Presence of God",Alfonso María de Liguori,"Liguori, Alfonso María de",,"=""""","=""""",0,4.75,Scriptoria Books,Kindle Edition,152,2014,2011,,2022/02/02,"to-read, spiritual-reading","to-read (#37), spiritual-reading (#3)",to-read,,,,0,0
398834,Introduction to the Devout Life,Francis de Sales,"Sales, Francis de",,"=""0375725628""","=""9780375725623""",0,4.38,Vintage,Paperback,288,2002,1609,,2022/02/02,"to-read, spiritual-reading","to-read (#36), spiritual-reading (#2)",to-read,,,,0,0
724457,Divine Intimacy: Meditations on the Interior Life for Every Day of the Liturgical Year,Gabriel of St. Mary Magdalen,"Magdalen, Gabriel of St. Mary",,"=""0895558173""","=""9780895558176""",0,4.82,TAN Books and Publishers,Leather Bound,1182,2006,1952,,2022/02/02,"to-read, spiritual-reading","to-read (#35), spiritual-reading (#1)",to-read,,,,0,0
101947,"The Knight  (The Wizard Knight, #1)",Gene Wolfe,"Wolfe, Gene",,"=""0765309890""","=""9780765309891""",0,3.76,Tor Books,Hardcover,432,2004,2004,2022/01/12,2021/12/09,,,read,,,,1,0
247000,The Mezzanine,Nicholson Baker,"Baker, Nicholson",,"=""0679725768""","=""9780679725763""",0,3.84,Vintage,Paperback,135,1990,1988,,2022/01/05,"to-read, infinity-pile","to-read (#33), infinity-pile (#15)",to-read,,,,0,0
133621,Enormous Changes at the Last Minute: Stories,Grace Paley,"Paley, Grace",,"=""0374515247""","=""9780374515249""",0,4.02,"Farrar, Straus and Giroux",Paperback,198,1985,1974,,2022/01/05,"to-read, infinity-pile","to-read (#32), infinity-pile (#14)",to-read,,,,0,0
7940591,Blockade Billy,Stephen        King,"King, Stephen",,"=""1587672286""","=""9781587672286""",0,3.48,Cemetery Dance Publications,Hardcover,112,2010,2010,2021/12/07,2021/12/01,,,read,,,,1,0
220937,The House on the Borderland,William Hope Hodgson,"Hodgson, William Hope",,"=""1426438281""","=""9781426438288""",0,3.60,BiblioBazaar,Paperback,152,2006,1908,2021/10/20,2021/07/24,,,read,,,,1,0
30285138,The Twenty Days of Turin,Giorgio De Maria,"Maria, Giorgio De",Ramon Glazov,"=""1631492292""","=""9781631492297""",0,3.70,Liveright,Hardcover,224,2017,1977,2021/09/22,2021/08/07,,,read,,,,1,0
3805,The Corrections,Jonathan Franzen,"Franzen, Jonathan",,"=""1841156736""","=""9781841156736""",0,3.84,Fourth Estate Paperbacks,Paperback,653,2002,2001,,2021/08/25,"to-read, infinity-pile","to-read (#30), infinity-pile (#13)",to-read,,,,0,0
32081,"Albion's Seed: Four British Folkways in America (America: A Cultural History, Vol. I)",David Hackett Fischer,"Fischer, David Hackett",,"=""0195069056""","=""9780195069051""",0,4.37,Oxford University Press,Paperback,946,1989,1989,,2021/08/25,"to-read, infinity-pile","to-read (#29), infinity-pile (#12)",to-read,,,,0,0
119512,The Melancholy of Resistance,László Krasznahorkai,"Krasznahorkai, László",George Szirtes,"=""0811215040""","=""9780811215046""",0,4.15,New Directions,Paperback,314,2002,1989,,2021/08/22,"to-read, infinity-pile","to-read (#28), infinity-pile (#11)",to-read,,,,0,0
14265,Under the Glacier,Halldór Laxness,"Laxness, Halldór",Magnus Magnusson,"=""1400034418""","=""9781400034413""",0,3.55,Vintage,Paperback,240,2005,1968,,2021/08/22,"to-read, infinity-pile","to-read (#27), infinity-pile (#10)",to-read,,,,0,0
117833,The Master and Margarita,Mikhail Bulgakov,"Bulgakov, Mikhail","Михаил Афанасьевич Булгаков, Diana Lewis Burgin, Katherine Tiernan O'Connor, Ellendea Proffer, Hans Fronius","=""0679760806""","=""9780679760801""",0,4.29,Vintage International,Paperback,372,1996,1967,,2021/08/16,"to-read, halloween","to-read (#26), halloween (#1)",to-read,,,,0,0
48287,Norwood,Charles Portis,"Portis, Charles",,"=""0879517034""","=""9780879517038""",0,3.85,Peter Mayer Publishing ,Paperback,190,1999,1966,,2021/08/10,"to-read, infinity-pile","to-read (#25), infinity-pile (#8)",to-read,,,,0,0
19089,Middlemarch,George Eliot,"Eliot, George",Michel Faber,"=""0451529170""","=""9780451529176""",0,4.03,Signet,Mass Market Paperback,912,2003,1872,,2021/07/22,"to-read, infinity-pile","to-read (#23), infinity-pile (#7)",to-read,,,,0,0
6313651,Utopia of Usurers and Other Essays,G.K. Chesterton,"Chesterton, G.K.",,"=""""","=""""",0,3.76,,Kindle Edition,189,,1917,,2020/09/01,"to-read, infinity-pile","to-read (#22), infinity-pile (#6)",to-read,,,,0,0
55967913,Collected Stories,Donald Barthelme,"Barthelme, Donald",Charles McGrath,"=""1598536842""","=""9781598536843""",0,4.38,Library of America,Hardcover,1168,2021,1989,2021/07/18,2021/07/02,,,read,,,,1,0
527513,Mating,Norman Rush,"Rush, Norman",,"=""067973709X""","=""9780679737094""",0,3.83,Vintage,Paperback,480,1992,1991,,2021/07/14,"to-read, infinity-pile","to-read (#21), infinity-pile (#5)",to-read,,,,0,0
77721,"The Book of the Dun Cow (Chauntecleer the Rooster, #1)",Walter Wangerin Jr.,"Jr., Walter Wangerin",,"=""0060574607""","=""9780060574604""",0,4.03,HarperOne,Paperback,246,2003,1978,,2021/07/14,"to-read, infinity-pile","to-read (#20), infinity-pile (#4)",to-read,,,,0,0
48692505,Lost in Thought: The Hidden Pleasures of an Intellectual Life,Zena Hitz,"Hitz, Zena",,"=""0691189234""","=""9780691189239""",0,3.64,Princeton University Press,Kindle Edition,240,2020,2020,,2021/07/11,"to-read, infinity-pile","to-read (#19), infinity-pile (#3)",to-read,,,,0,0
49673,The Napoleon of Notting Hill,G.K. Chesterton,"Chesterton, G.K.",,"=""1600965237""","=""9781600965234""",5,3.83,Waking Lion Press,Paperback,184,2007,1904,2015/10/12,2015/12/29,,,read,"To the extent that I have a political manifesto, it is this.",,,2,0
45154547,"A Desolation Called Peace (Teixcalaan, #2)",Arkady Martine,"Martine, Arkady",,"=""125018648X""","=""9781250186485""",0,4.32,Tor Books,Kindle Edition,496,2021,2021,2021/07/01,2020/04/10,,,read,,,,1,0
44735,The Elements of Typographic Style,Robert Bringhurst,"Bringhurst, Robert",,"=""0881792063""","=""9780881792065""",0,4.26,Hartley and Marks Publishers,Paperback,352,2004,1992,,2021/06/15,"to-read, infinity-pile","to-read (#16), infinity-pile (#1)",to-read,,,,0,0
18242,"A Savage War of Peace: Algeria, 1954-1962",Alistair Horne,"Horne, Alistair",,"=""1590172183""","=""9781590172186""",0,4.23,New York Review of Books,Paperback,608,2006,1977,,2021/05/23,to-read,to-read (#15),to-read,,,,0,0
18527923,How to Be a Monastic and Not Leave Your Day Job: A Guide for Benedictine Oblates and Other Christians Who Follow the Monastic Way (Voices from the Monastery),Benet Tvedten,"Tvedten, Benet",,"=""1612614140""","=""9781612614144""",0,3.88,Paraclete Press,Paperback,160,2013,2006,,2021/03/14,currently-reading,currently-reading (#3),currently-reading,,,,1,0
50202953,Piranesi,Susanna Clarke,"Clarke, Susanna",,"=""163557563X""","=""9781635575637""",0,4.22,Bloomsbury,Hardcover,272,2020,2020,2021/01/28,2021/01/06,,,read,,,,1,0
13356675,"A Wizard of Earthsea (Earthsea Cycle, #1)",Ursula K. Le Guin,"Guin, Ursula K. Le",,"=""0547722028""","=""9780547722023""",0,4.01,Clarion Books,Paperback,251,2012,1968,2021/01/02,2020/12/02,,,read,,,,1,0
31618816,Rule of St. Benedict,Benedict of Nursia,"Nursia, Benedict of",,"=""1530221056""","=""9781530221059""",0,3.99,CreateSpace Independent Publishing Platform,Paperback,72,2016,530,2019/12/27,2019/03/20,,,read,,,,1,0
373755,"Absalom, Absalom!",William Faulkner,"Faulkner, William",,"=""0679732187""","=""9780679732181""",0,3.98,Vintage,Paperback,316,1990,1936,,2020/12/08,to-read,to-read (#14),to-read,,,,0,0
2330204,Mont-St-Michel and Chartres,Henry Adams,"Adams, Henry",,"=""0451603176""","=""9780451603173""",0,3.94,Signet,Paperback,0,,1904,,2020/12/08,to-read,to-read (#13),to-read,,,,0,0
344935,Latro in the Mist (Latro #1-2),Gene Wolfe,"Wolfe, Gene",,"=""0765302942""","=""9780765302946""",0,4.20,Orb Books,Paperback,640,2003,2003,,2020/12/08,to-read,to-read (#12),to-read,,,,0,0
39776179,"Dune (Dune, #1)",Frank Herbert,"Herbert, Frank",,"=""0441013597""","=""9780441013593""",4,4.28,Ace,Paperback,704,2005,1965,2020/12/01,2020/09/01,,,read,"I should start by saying I liked this book a lot (I gave it four stars for goodness sake). It's deeply imaginative. It has, like any epic should, a strong sense of a larger world going on off the page,  which the narrative of the book reveals only bit by bit. Lots of memorable lines and phrases.<br/><br/>It's not fair, I know, but I just wanted to like it more. It's not on the same level as the best of the best scifi/fantasy epics, like The Lord of the Rings or The Book of the New Sun. The prose is fine, it's not as bad as I was warned it could be, but Herbert not Tolkien or Wolfe. I didn't have the same sense of awed wonder that I expect from this kind of grandly ambitious novel. Maybe if I'd read it at 15 instead of 35.<br/><br/>All in all, a very good novel but it falls just short of the masterpiece tier I was hoping for.",,,1,0
13175692,The Shadow over Innsmouth,H.P. Lovecraft,"Lovecraft, H.P.",,"=""1450562795""","=""9781450562799""",0,4.10,Visionary Publishing Company,Paperback,158,1936,1936,2020/10/27,2020/10/16,,,read,,,,1,0
12948,The Turn of the Screw,Henry James,"James, Henry",,"=""0140620613""","=""9780140620610""",0,3.39,Penguin Books,Paperback,121,1994,1898,2020/10/16,2020/10/07,,,read,,,,1,0
60403,Love in the Ruins,Walker Percy,"Percy, Walker",,"=""0312243111""","=""9780312243111""",0,3.83,Picador,Paperback,416,1999,1971,2020/08/31,2017/08/17,,,read,,,,1,0
14935,Sense and Sensibility,Jane Austen,"Austen, Jane","Ros Ballaster, Джейн Остин, Mobile Classics, Силвия Желева","=""0141439661""","=""9780141439662""",0,4.09,Penguin Books,Paperback,409,2003,1811,2020/07/23,2020/04/14,,,read,,,,1,0
7648269,Empire of the Summer Moon,S.C. Gwynne,"Gwynne, S.C.",,"=""1416591052""","=""9781416591054""",0,4.24,Scribner,Hardcover,371,2010,2010,,2020/07/11,to-read,to-read (#11),to-read,,,,0,0
2627490,The Dream of Gerontius,John Henry Newman,"Newman, John Henry",,"=""1602068038""","=""9781602068032""",5,4.19,Cosimo Inc,Paperback,80,2007,1865,2020/04/22,2019/10/01,,,read,,,,1,0
2878702,An Evil Guest,Gene Wolfe,"Wolfe, Gene",,"=""0765321335""","=""9780765321336""",2,3.12,Tor,Hardcover,304,2008,2008,2019/09/16,2019/08/15,,,read,"I’m a big Gene Wolfe fan, but this one didn’t do it for me. Usually Wolfe’s prose itself is lush and beautiful, leaving you *feeling* something about the story even when you don’t fully understand what’s happening on a rational level. The clipped, pulpy style he uses here didn’t draw me in or make me care particularly about any of the characters or what happened to them. I’ve gathered from reading the usual Wolfe sites that there’s quite a bit more going on here than I picked up in my initial reading. But I don’t think I could bring myself to pick it up again to find out.",,,1,0
45046585,"A Memory Called Empire (Teixcalaan, #1)",Arkady Martine,"Martine, Arkady",,"=""1250186447""","=""9781250186447""",3,4.12,Tor Books,Paperback,480,2020,2019,2020/04/09,2020/03/02,,,read,"I’ve read some of the other three star reviews and I feel bad that I gave it the same rating. I liked AMCE a lot. <br/><br/>Teixcalaan is an engrossing world to explore. The author avoided taking the easy routes of making the all-encompassing empire a direct clone of either Ancient Rome or Nazi Germany. There are obvious parallels to Aztec culture, and Martine has said she based Lsel on medieval Armenia, both of which I’d suddenly like to know a lot more about.<br/><br/>I have a lot of thoughts about home and empire but I’m not sure I could do justice here.<br/><br/>The only real reason I gave it three stars was that it’s probably not timelessly substantial. It’s not Shakespeare, it’s not even Gene Wolfe, but it’s better than you you can reasonably expect a pulpy space opera to be.",,,1,0
174936,The Practice of the Presence of God,Brother Lawrence,"Lawrence, Brother","Henri J.M. Nouwen, John J.  Delaney","=""0385128614""","=""9780385128612""",0,4.32,Image,Paperback,112,1977,1692,2020/04/02,2020/04/01,,,read,,,,1,0
24694092,Laurus,Eugene Vodolazkin,"Vodolazkin, Eugene","Evgenij Vodolazkin, Lisa Hayden","=""1780747551""","=""9781780747552""",5,4.22,Oneworld Publications,Hardcover,365,2015,2012,2020/03/02,2019/03/19,,,read,,,,1,0
267095,Strangers to the City: Reflections on the Beliefs and Values of the Rule of St. Benedict,Michael Casey,"Casey, Michael",,"=""1557254605""","=""9781557254603""",0,4.28,Paraclete Press,Paperback,212,2005,2005,,2020/02/09,to-read,to-read (#7),to-read,,,,0,0
765395,Roald Dahl's Book of Ghost Stories,Roald Dahl,"Dahl, Roald",,"=""0374518688""","=""9780374518684""",0,3.64,"Farrar, Straus and Giroux",Paperback,235,1984,1983,2020/02/06,2020/01/03,,,read,,,,1,0
385690,A Primer of Ecclesiastical Latin,John F.  Collins,"Collins, John F.",,"=""0813206677""","=""9780813206677""",0,4.19,The Catholic University of America Press,Paperback,451,2022,1985,,2020/01/04,currently-reading,currently-reading (#1),currently-reading,,,,1,0
24674068,"The Noonday Devil: Acedia, the Unnamed Evil of Our Times",Jean-Charles Nault,"Nault, Jean-Charles","Michael J. Miller, Akvilė Melkūnaitė","=""158617939X""","=""9781586179397""",0,4.26,Ignatius Press,Paperback,208,2015,2015,2019/12/27,2018/11/09,,,read,,,,1,0
42922249,Knight of the Holy Ghost: A Short History of G. K. Chesterton,Dale Ahlquist,"Ahlquist, Dale",,"=""0999375644""","=""9780999375648""",0,4.49,Augustine Institute - Ignatius Press,Paperback,208,2018,,2019/09/05,2019/03/19,,,read,,,,1,0
2647775,Castleview,Gene Wolfe,"Wolfe, Gene",,"=""0312850085""","=""9780312850081""",0,3.32,Tor Books,Hardcover,400,1990,1990,2019/08/03,2019/07/23,,,read,,,,1,0
25225,The Samurai,Shūsaku Endō,"Endō, Shūsaku",Van C. Gessel,"=""0811213463""","=""9780811213462""",4,4.02,New Directions ,Paperback,272,1997,1980,2019/07/08,2018/10/30,,,read,,,,1,0
929587,"Tlön, Uqbar, Orbis Tertius",Jorge Luis Borges,"Borges, Jorge Luis",,"=""0889840725""","=""9780889840720""",0,4.33,Porcupine's Quill,Paperback,78,1982,1940,,2019/06/11,,,read,,,,1,0
2839777,The Life and Glories of St. Joseph,Edward Healy Thompson,"Thompson, Edward Healy",,"=""0895551616""","=""9780895551610""",0,4.17,TAN Books,Paperback,520,1980,1891,,2019/05/01,to-read,to-read (#6),to-read,,,,0,0
11149,The Screwtape Letters,C.S. Lewis,"Lewis, C.S.",,"=""0060652896""","=""9780060652890""",0,4.27,HarperCollins,Hardcover,209,2001,1942,2019/04/23,2019/03/19,,,read,,,,1,0
12444229,Rerum Novarum: Encyclical Letter - Rights and Duties of Capital and Labour (Vatican Documents),Pope Leo XIII,"XIII, Pope Leo",,"=""1860821537""","=""9781860821530""",5,4.36,Catholic Truth Society,Paperback,19,1983,1891,2019/03/19,2018/03/30,,,read,,,,1,0
7678949,Saint Thomas Aquinas: The Dumb Ox,G.K. Chesterton,"Chesterton, G.K.",,"=""1450516351""","=""9781450516358""",0,4.10,Createspace Independent Pub,Paperback,110,2010,1933,2019/03/13,2019/02/14,,,read,,,,1,0
18222775,The Name of the Rose,Umberto Eco,"Eco, Umberto",,"=""0544176561""","=""9780544176560""",0,4.14,HarperVia,Paperback,579,2014,1980,2019/02/06,2018/11/19,,,read,,,,1,0
1458575,Green Tea,J. Sheridan Le Fanu,"Fanu, J. Sheridan Le",,"=""1425010377""","=""9781425010379""",3,3.27,Read How You Want ,Paperback,88,2006,1872,2018/11/09,2018/10/29,,,read,,,,1,0
31242,Bleak House,Charles Dickens,"Dickens, Charles","Nicola Bradbury, Hablot Knight Browne","=""0143037617""","=""9780143037613""",0,4.02,Penguin Books,Paperback,1017,2006,1853,,2018/10/30,to-read,to-read (#5),to-read,,,,0,0
40496146,A Bloody Habit,Eleanor Bourg Nicholson,"Nicholson, Eleanor Bourg",,"=""1621642062""","=""9781621642060""",3,4.10,Ignatius Press,Paperback,435,2018,2018,2018/10/29,2018/09/30,,,read,,,,1,0
26114341,"The Big Sheep (The Big Sheep, #1)",Robert Kroese,"Kroese, Robert",,"=""1250088445""","=""9781250088444""",0,3.67,Thomas Dunne Books,Hardcover,320,2016,2016,2018/09/05,2018/08/01,,,read,,,,1,0
12550,"Stiff Upper Lip, Jeeves (Jeeves, #13)",P.G. Wodehouse,"Wodehouse, P.G.",,"=""184159105X""","=""9781841591056""",0,4.22,Everyman's Library,Hardcover,211,2002,1963,2018/08/17,2018/08/07,,,read,,,,1,0
248596,Something Wicked This Way Comes,Ray Bradbury,"Bradbury, Ray",,"=""0380729407""","=""9780380729401""",0,3.90,Harper Voyager,Mass Market Paperback,293,1998,1962,2018/08/07,2018/07/20,,,read,,,,1,0
35296862,Motherfoclóir: Dispatches from a Not So Dead Language,Darach Ó Séaghdha,"Séaghdha, Darach Ó",,"=""""","=""""",0,4.14,Head of Zeus,Kindle Edition,240,2017,2017,2018/08/01,2017/12/27,,,read,,,,1,0
37783442,"The Dream of the Iron Dragon (Saga of the Iron Dragon, #1)",Robert Kroese,"Kroese, Robert",,"=""""","=""""",0,4.13,,Kindle Edition,480,2018,2018,2018/07/15,2018/01/21,,,read,,,,1,0
62005,A Night in the Lonesome October,Roger Zelazny,"Zelazny, Roger",Gahan Wilson,"=""0380771411""","=""9780380771417""",3,4.16,Avon Books,Paperback,280,1994,1993,2017/11/25,2017/09/08,,,read,,,,1,0
184419,The Man Who Was Thursday: A Nightmare,G.K. Chesterton,"Chesterton, G.K.","Jonathan Lethem, José Laurênio de Mello","=""0375757910""","=""9780375757914""",4,3.83,Modern Library,Paperback,182,2001,1908,,2013/02/17,,,read,,,,2,0
18184122,Analyzing Baseball Data with R (The R Series),Max Marchi,"Marchi, Max",Jim Albert,"=""1466570229""","=""9781466570221""",0,4.26,Routledge,Paperback,352,2013,2013,2017/09/08,2015/12/31,,,read,,,,1,0
845501,The Fifth Head of Cerberus,Gene Wolfe,"Wolfe, Gene",,"=""0312890206""","=""9780312890209""",5,3.99,Orb Trade,Paperback,252,1994,1972,2015/10/20,2015/12/29,re-read,re-read (#1),read,,,,2,0
429024,The Old Curiosity Shop,Charles Dickens,"Dickens, Charles","Norman Page, Golgotha Press","=""0140437428""","=""9780140437423""",0,3.79,Wordsworth Editions Ltd,Paperback,576,2001,1840,,2017/04/20,to-read,to-read (#4),to-read,,,,0,0
6845909,The Sorcerer's House,Gene Wolfe,"Wolfe, Gene",,"=""076532458X""","=""9780765324580""",3,3.74,Tor Books,Hardcover,302,2010,2010,2017/04/17,2017/03/30,,,read,"I finished this book and thought ""Meh"". A lot of stuff happens and then it ends. It was enjoyable, but there was seemingly not as much substance as other of Wolfe's novels.<br/><br/>Then I started listening to a podcast called Alzabo Soup where the hosts go through the book chapter by chapter, explaining the some of the intriguing inconsistencies and double meanings that I missed the first time through. Without spoilers, I will just say don't trust the narrator and read the book closely.<br/><br/>I rated it a bit lower because I don't think the surface-level story is as enjoyable as other Wolfe books. But I think a careful re-reading and discussion open up a lot that isn't immediately apparent and very intriguing.",,,1,0
24969677,City of Sand,Robert Kroese,"Kroese, Robert",,"=""""","=""""",3,4.11,,Unknown Binding,,2015,2015,2017/02/15,2017/02/08,,,read,,,,1,0
25200,Silence,Shūsaku Endō,"Endō, Shūsaku",William Johnston,"=""0800871863""","=""9780800871864""",4,4.09,Taplinger Publishing Company,Paperback,219,1980,1966,2017/02/04,2017/01/07,,,read,,,,1,0
157993,The Little Prince,Antoine de Saint-Exupéry,"Saint-Exupéry, Antoine de",Richard Howard,"=""0152023984""","=""9780152023980""",0,4.33,"Harcourt, Inc.",Hardcover,96,2000,1943,,2017/01/16,to-read,to-read (#2),to-read,,,,0,0
11851522,The Complete Works of H.P. Lovecraft,H.P. Lovecraft,"Lovecraft, H.P.",,"=""""","=""""",0,4.34,CthulhuChick.com,Kindle Edition,811,2011,1936,2015/10/01,2015/12/29,,,read,,,,1,0
271578,Endangered Species: Short Stories,Gene Wolfe,"Wolfe, Gene",,"=""0765310333""","=""9780765310330""",4,3.94,Orb Books,Paperback,512,2004,1989,2016/04/25,2015/12/31,,,read,,,,1,0
29522158,Iron Chamber of Memory,John C. Wright,"Wright, John C.",,"=""""","=""""",4,4.01,Castalia House,Kindle Edition,242,2016,2016,2016/04/08,2016/04/08,,,read,,,,1,0
2079415,Lord of the World,Robert Hugh Benson,"Benson, Robert Hugh",,"=""1406548421""","=""9781406548426""",5,4.09,Dodo Press,Paperback,296,2007,1907,2016/02/27,2016/01/03,,,read,,,,1,0
8104530,PIRATE FREEDOM,Gene Wolfe,"Wolfe, Gene",,"=""0765318792""","=""9780765318794""",0,3.69,Tor Trade,Paperback,320,2010,2007,2016/01/24,2015/12/31,,,read,,,,1,0
174873,St. Francis of Assisi,G.K. Chesterton,"Chesterton, G.K.",Joseph F. Girzone,"=""0385029004""","=""9780385029001""",5,3.94,Image,Paperback,176,1987,1923,2013/08/21,2013/07/21,,,read,,,,1,0
10034956,Three to Get Married,Fulton J. Sheen,"Sheen, Fulton J.",,"=""""","=""""",2,4.60,Scepter Publishers,Paperback,216,2005,1951,,2015/12/30,,,read,,,,1,0
60211,"The Shadow of the Torturer (The Book of the New Sun, #1)",Gene Wolfe,"Wolfe, Gene",,"=""0671540661""","=""9780671540661""",5,3.84,Pocket,Paperback,262,1984,1980,2014/08/01,2015/12/29,,,read,,,,1,0
463376,"The Claw of the Conciliator (The Book of the New Sun, #2)",Gene Wolfe,"Wolfe, Gene",,"=""0671416162""","=""9780671416164""",4,4.00,Pocket,Paperback,303,1982,1981,2014/09/01,2015/12/29,,,read,,,,1,0
40995,"Sword & Citadel (The Book of the New Sun, #3-4)",Gene Wolfe,"Wolfe, Gene",,"=""0312890184""","=""9780312890186""",4,4.35,Orb Books,Paperback,411,1994,1994,2014/10/01,2015/12/29,,,read,,,,1,0
60215,"The Urth of the New Sun (The Book of the New Sun, #5)",Gene Wolfe,"Wolfe, Gene",,"=""0312863942""","=""9780312863944""",4,4.05,Orb Books,Paperback,372,1997,1987,2014/12/01,2015/12/29,,,read,,,,1,0
16141924,Dad Is Fat,Jim Gaffigan,"Gaffigan, Jim",,"=""0385349068""","=""9780385349062""",3,3.78,Crown Archetype,ebook,288,2013,2013,2014/12/30,2015/12/29,,,read,,,,1,0
340381,"The Lord of the Rings (The Lord of the Rings, #1-3)",J.R.R. Tolkien,"Tolkien, J.R.R.",Alan  Lee,"=""""","=""""",5,4.53,Houghton Mifflin Harcourt,Hardcover,1216,1991,1955,2015/12/29,2013/03/14,,,read,,,,1,0
18131,"A Wrinkle in Time (A Wrinkle in Time Quintet, #1)",Madeleine L'Engle,"L'Engle, Madeleine",,"=""0440498058""","=""9780440498056""",4,3.98,Yearling Books,Paperback,211,1973,1962,2015/02/01,2015/12/29,,,read,,,,1,0
