Book Id,Title,Author,Author l-f,Additional Authors,ISBN,ISBN13,My Rating,Average Rating,Publisher,Binding,Number of Pages,Year Published,Original Publication Year,Date Read,Date Added,Bookshelves,Bookshelves with positions,Exclusive Shelf,My Review,Spoiler,Private Notes,Read Count,Owned Copies
18130,"A Wind in the Door (Time Quintet, #2)",Madeleine L'Engle,"L'Engle, Madeleine",,"=""0440487617""","=""9780440487616""",3,3.99,Dell Laurel-Leaf,Mass Market Paperback,236,1976,1973,2015/02/10,2015/12/29,,,read,,,,1,0
13538873,"Mr. Penumbra's 24-Hour Bookstore (Mr. Penumbra's 24-Hour Bookstore, #1)",Robin Sloan,"Sloan, Robin",,"=""0374214913""","=""9780374214913""",3,3.72,"Farrar, Straus and Giroux",Hardcover,288,2012,2012,2015/05/01,2015/12/29,,,read,,,,1,0
2570856,"Monster Hunter International (Monster Hunter International, #1)",Larry Correia,"Correia, Larry",,"=""0741444569""","=""9780741444561""",2,4.06,Infinity Publishing,Paperback,557,2009,2009,2015/06/01,2015/12/29,,,read,,,,1,0
1885,Pride and Prejudice,Jane Austen,"Austen, Jane",Anna Quindlen,"=""1441341706""","=""9781441341709""",4,4.29,Modern Library,Paperback,279,2023,1813,2015/07/10,2015/12/29,,,read,,,,1,0
25850553,"Somewhither (The Unwithering Realm Omnibus, #1)",John C. Wright,"Wright, John C.",,"=""""","=""""",3,3.91,Castalia House,Kindle Edition,590,2015,2015,2015/11/20,2015/12/29,,,read,,,,1,0
30930,"Black Mischief, Scoop, The Loved One, The Ordeal of Gilbert Pinfold",Evelyn Waugh,"Waugh, Evelyn",,"=""1400040779""","=""9781400040773""",0,4.24,Everyman's Library,Hardcover,622,2003,2003,2013/07/21,2013/02/17,,,read,,,,1,0
4934,The Brothers Karamazov,Fyodor Dostoevsky,"Dostoevsky, Fyodor","Richard Pevear, Larissa Volokhonsky","=""0374528373""","=""9780374528379""",5,4.38,"Farrar, Straus and Giroux",Paperback,796,2002,1880,2013/02/16,2013/02/16,,,read,,,,1,0
379457,"The Bad Catholic's Guide to Good Living: A Loving Look at the Lighter Side of Catholic Faith, with Recipes for Feasts and Fun",John Zmirak,"Zmirak, John",Denise Matychowiak,"=""0824523008""","=""9780824523008""",4,4.30,Crossroad Publishing,Paperback,240,2005,2005,,2013/02/17,,,read,,,,1,0
12985,The Tempest,William Shakespeare,"Shakespeare, William","Paul Werstine, David Lindley, Israel Gollancz, Barbara A. Mowat, Arthur Wilson Verity, Georg Brandes, G.B. Harrison, William James Rolfe","=""""","=""""",0,3.78,Washington Square Press,Mass Market Paperback,218,2004,1611,2013/03/10,2013/02/12,,,read,,,,1,0
313765,A Guide for the Perplexed,Ernst F. Schumacher,"Schumacher, Ernst F.",,"=""0060906111""","=""9780060906115""",5,3.97,Harper Perennial,Paperback,160,1978,1977,,2013/02/17,,,read,,,,1,0
3382380,The Last Superstition: A Refutation of the New Atheism,Edward Feser,"Feser, Edward",,"=""1587314517""","=""9781587314513""",3,4.28,St. Augustine's Press,Hardcover,312,2008,2008,,2013/02/17,,,read,"If you want to understand the classical philosophical framework that much of traditional Christian theology is based on, this book does a great job of explaining it. Ed Feser is a Thomistic philosophy professor who really knows how to make complex concepts make sense in a concrete way. This might be the most accessible overview of classical and Scholastic philosophy I've ever read. I'd love to give it 5 stars.<br/><br/>Sadly, I can't. Feser spends too much time making snide comments about the purveyors of ""New Atheism"". They mostly deserve it and its often amusing to me to see a good BURN! against an ideological opponent. But by stooping to that level, the book becomes an exercise in preaching to the choir. The people who I'd like to recommend the book to and would be most likely to benefit from it would likely be turned off by the aggressive tone.<br/><br/>I wish Dr. Feser had taken Aquinas's cool-headed tone along with his philosophical framework.",,,1,0
100933,"That Hideous Strength (The Space Trilogy, #3)",C.S. Lewis,"Lewis, C.S.",,"=""0007157177""","=""9780007157174""",5,3.92,HarperCollins Publishers,Paperback,534,2005,1945,,2013/02/17,,,read,,,,1,0
79428,The Abolition of Man,C.S. Lewis,"Lewis, C.S.",,"=""0060652942""","=""9780060652944""",5,4.12,HarperOne,Paperback,113,2015,1943,,2013/02/17,,,read,,,,1,0
100924,"Perelandra (The Space Trilogy, #2)",C.S. Lewis,"Lewis, C.S.",,"=""0007157169""","=""9780007157167""",4,4.01,HarperCollins,Paperback,288,2005,1943,,2013/02/17,,,read,,,,1,0
87665,Orthodoxy,G.K. Chesterton,"Chesterton, G.K.",,"=""160096527X""","=""9781600965272""",5,4.19,Waking Lion Press,Paperback,168,2007,1908,2013/02/16,2013/02/16,,,read,,,,1,0
25350,"Out of the Silent Planet (The Space Trilogy, #1)",C.S. Lewis,"Lewis, C.S.",,"=""0007157150""","=""9780007157150""",4,3.93,HarperCollins,Paperback,160,2005,1938,,2013/02/17,,,read,,,,1,0
1254680,The Place Within: The Poetry of Pope John Paul II,Pope John Paul II,"II, Pope John Paul",,"=""0679760644""","=""9780679760641""",0,4.40,Random House Publishing Group,Paperback,208,1994,2003,,2013/02/17,,,read,,,,1,0
653001,The Hound of the Baskervilles,Arthur Conan Doyle,"Doyle, Arthur Conan",,"=""0486282147""","=""9780486282145""",0,4.13,Dover Publications,Paperback,124,1994,1902,,2013/02/17,,,read,,,,1,0
554286,The Hobbit,J.R.R. Tolkien,"Tolkien, J.R.R.",Peter Sís,"=""061815082X""","=""9780618150823""",0,4.29,Clarion Books,Paperback,330,2001,1937,,2013/02/17,,,read,,,,1,0
174853,Favorite Father Brown Stories,G.K. Chesterton,"Chesterton, G.K.",,"=""0486275450""","=""9780486275451""",0,3.64,Dover Publications,Paperback,96,1993,1935,,2013/02/17,,,read,,,,1,0
8136687,Send Out Your Spirit: A Confirmation Candidate's Handbook for Faith,Michael Amodei,"Amodei, Michael",,"=""1594712255""","=""9781594712258""",3,4.00,Ave Maria Pr,Paperback,244,2010,2010,,2013/02/13,,,read,"A good overview of the Catholic faith for high school aged students. The topic is obviously too broad to go into much depth on any one thing in particular, but the content is good for the level it's at. A HUGE improvement over the previous edition.",,,1,0
